1,치키별에 어서 와,치키별에서 플레이어는 선발대로서 여러 가지 샘플을 수집해야 한다. NPC의 도움을 받아 치키별에 적응하자!,true,,0,0,안녕~! 네가 오늘 온다는 탐사대원이구나?,내 이름은 삼냥이야. 잘 부탁해 냐!,치키별에 적응할 수 있도록 내가 도와줄게!
2,위험지역의 몬스터들,치키별에는 여러 가지 위험지역이 있다. 가장 오른쪽에 위치한 화염 지역으로 이동해 <탐포링>을 처치하고 후라이팬을 얻자.,true,1,0,1,미니맵을 한 번 확인해 볼래?,오른쪽에 불 모양의 마크가 보여?,거긴 화염 지역이야. 용암이 들끓는 곳이지.
3,야생식물을 채집해 보자,치키별에는 다양한 야생 식물이 곳곳에 자라나고 있다. 전부 먹을 수 있다니 진짜일까?,true,2,11,5,잘했어!,치키별에는 이렇게 몬스터에게서 얻을 수 있는 것도 있지만...,여기저기 채집할 수 있는 야생식물도 자라나고 있어.,당근 5개만 채집해 볼래?
4,치키별에서 살아남는 법,치키별에서 얻을 수 있는 샘플들로 요리를 해보자. 만든 음식들은 나를 강하게 해 줄 거야.,true,3,0,1,너 정말 적응이 빠르구나!?,네가 얻은 프라이팬과 당근으로 요리를 할 수 있어.,Q를 눌러서 만들어 봐.,우클릭을 누르면 음식을 먹을 수 있어!
5,탐사대 임무 완료!,각 위험지역의 마지막 스테이지까지 도달해 보물 상자에서 별을 가져오자.,true,4,0,3,어때? 조금 힘이 나는 것 같아?,내가 모아둔 다양한 레시피가 있어.,참고해서 여러 가지 음식을 만들어봐.,위험 지역을 전부 돌아보는 데에 도움을 줄 거야.,그럼 화이팅~!
6,낚시를 배워볼까?,해양 지역을 탐사하고 있는 강태곰에게 낚시를 배워보자.,true,1,0,1,안녕?,네가 바로 소문의 그 녀석이구나? 곰곰.,낚시를 배우고 싶다고?,안 그래도 남는 낚싯대가 있기는 해.,마침 참치가 무지 먹고 싶은데 곰곰...,한 마리만 잡아 와 준다면 낚싯대를 선물로 줄게.