1,치키별에 어서 와!,삼냥이와 대화하기,,100,0,안녕~! 네가 오늘 온다는 탐사대원이구나!, 나는 삼냥이야. 잘 부탁해!,치키별에 잘 적응할 수 있도록 내가 도와줄게.,궁금한 게 있으면 언제든지 나를 찾아와!
2,위험지역의 몬스터들,탐포링의 조미료 수집하기,1,47,1,미니맵을 한 번 확인해 볼래?,오른쪽에 불 모양의 마크가 보이지?,그곳은 화염 지역이야. 용암이 가득한 곳이지!,그 곳에는 위험한 몬스터들이 돌아다니고 있어., 맞아! 네가 물리쳐야 할 몬스터들 말이야.,내가 검을 줄게.,Q를 눌러 칼을 휘두를 수 있어.,그럼 탐포링의 탐포링의 조미료를 얻어와!,행운을 빌게.,
3,야생식물을 채집하자!,당근 채집하기,2,11,3,정말 잘했어!,있지...,치키별에는 몬스터에게서 얻는 것도 많지만,여기저기서 자생하는 야생식물도 많이 자라고 있어.,다가가서 E를 꾹 눌러봐~,우선 당근을 한 번 채집해 올래?
4,치키별에서 살아남기,당근 스프 요리하기,3,1000,1,너 정말 적응이 빠르구나!,네가 모은 재료들로 당근 스프를 만들 수 있어.,Q를 눌러서 레시피에 맞게 아이템을 가져다 만들어 봐!,우클릭을 누르면 음식을 먹을 수 있어!
5,탐사대 임무 완료!,별 조각 모으기,4,0,3,어때? 조금 빨라진 것 같지 않아?,내가 모아둔 다양한 레시피도 있으니 참고해서 여러 가지 음식을 만들어봐.,위험 지역을 모두 돌아보는 데 도움을 줄 거야.,각 지역의 끝에 있는 몬스터들을 전부 처리하면,비밀의 상자가 나타난대!,상자 안에는 별이 있다나~,그럼 화이팅~!
6,물고기를 잡아볼까?,강태곰과 대화하기,1,100,0,안녕~ 너가 바로 소문으로 듣던 그 친구구나!,물고기를 잡고 싶다고? 좋아, 그럼 내가 도와줄게!,내가 쓰지 않는 낚싯대가 있어. 선물로 줄게!,낚시터에 가고 싶다면 언제든지 나를 찾아와~
7,참치가 좋아!,참치 낚기,6,32,3,여기 낚시터에는 다양한 물고기가 있어~,참치는 좋아하나?, 나도 참치가 아주 좋아!,이곳에서는 참치도 쉽게 잡을 수 있어~, 낚시터에 가서 물 위를 클릭해.,물고기가 찌를 물면 E를 눌러 낚으면 돼!,하지만 너무 늦으면 놓쳐버릴 거야.